img,url,title,desc,date
https://images.newindianexpress.com/uploads/user/imagelibrary/logo/nie_logo_600X390.jpg,https://www.newindianexpress.com/cities/hyderabad/2021/jun/18/mahabubnagar-four-dead-in-major-road-accident-2318253.html,Mahabubnagar: Four dead in major road accident,"According to Jadhcerla SI Shamshuddin, a tractor carrying paddy load was going towards Kalwakurthy, when two bikes were coming in the opposite direction. ",published on : 18th June 2021
https://images.newindianexpress.com/uploads/user/imagelibrary/logo/nie_logo_600X390.jpg,https://www.newindianexpress.com/states/kerala/2021/jun/06/two-keralite-nurses-die-in-saudi-road-accident-2312350.html,Two Keralite nurses die in Saudi road accident,The Kerala Muslim Cultural Centre unit in Najran said there were five people in the taxi and all of them were Keralites.,published on : 6th June 2021
https://images.newindianexpress.com/uploads/user/imagelibrary/logo/nie_logo_600X390.jpg,https://www.newindianexpress.com/states/karnataka/2021/may/15/three-killed-four-injured-in-road-accident-in-karnatakas-chitradurga-2302852.html,"Three killed, four injured in road accident in Karnataka's Chitradurga","Two daily wage labourers died on the spot, whereas the third person succumbed at Chitradurga district hospital.",published on : 15th May 2021
https://images.newindianexpress.com/uploads/user/imagelibrary/logo/nie_logo_600X390.jpg,https://www.newindianexpress.com/states/andhra-pradesh/2021/may/11/three-killed-in-road-accident-2301001.html,Three killed in road accident,Three members of a family were killed in a road accident when their two-wheeler was hit by a speeding car in at Thyalluru village on late Sunday night.,published on : 11th May 2021
https://images.newindianexpress.com/uploads/user/imagelibrary/logo/nie_logo_600X390.jpg,https://www.newindianexpress.com/cities/hyderabad/2021/may/08/hyderabad-police-inspector-wife-killed-in-road-accident-near-city-2299991.html,"Hyderabad police inspector, wife killed in road accident near city","While their son Kushalav escaped unhurt in the accident, the car they were travelling in crashed into a parked lorry.",published on : 8th May 2021
https://images.newindianexpress.com/uploads/user/imagelibrary/logo/nie_logo_600X390.jpg,https://www.newindianexpress.com/nation/2018/may/13/three-rjd-leaders-driver-killed-in-road-accident-while-returning-from-lalu-prasad-yadavs-son​s-we-1814217.html,"Three RJD leaders, driver killed in road accident while returning from Lalu Prasad Yadav’s son​'s wedding","Police said the deceased were RJD’s Kishanganj district president Intekhab Alam, the party’s Dighalganj block president Pappu, party activist Ikramul Haq Baghi and the driver of the car.",published on : 13th May 2018
https://images.newindianexpress.com/uploads/user/imagelibrary/logo/nie_logo_600X390.jpg,https://www.newindianexpress.com/nation/2018/feb/08/146-lakh-people-killed-in-road-accidents-in-2017-union-minister-gadkari-1770290.html,1.46 lakh people killed in road accidents in 2017: Union Minister Gadkari,Gadkari said in the Lok Sabha that a majority of the road accidents involved two-wheelers where the victims were not wearing helmets.,published on : 8th February 2018
https://images.newindianexpress.com/uploads/user/imagelibrary/logo/nie_logo_600X390.jpg,https://www.newindianexpress.com/cities/hyderabad/2017/oct/24/sana-iqbal-woman-biker-from-hyderabad-who-campaigned-against-suicide-dies-in-road-accident-1681518.html,"Sana Iqbal, woman biker from Hyderabad who campaigned against suicide dies in road accident",Twenty-nine-year-old Sana and her husband Abdul Nadeem were travelling to Tolichowki on the Outer Ring Road (ORR) near Hyderabad's Narsingi when their car rammed the median. ,published on : 24th October 2017
https://images.newindianexpress.com/uploads/user/imagelibrary/logo/nie_logo_600X390.jpg,https://www.newindianexpress.com/nation/2017/may/07/rajasthan-six-kids-die-in-road-accident-1602138.html,Rajasthan: Six kids die in road accident,The passengers were on their way to Khanpur from Daulatpura village to attend a mass marriage ceremony. ,published on : 7th May 2017
