img,url,title,desc,date
https://images.newindianexpress.com/uploads/user/imagelibrary/logo/nie_logo_600X390.jpg,https://www.newindianexpress.com/cities/chennai/2022/jan/11/chennai-corpto-finish-relaying-roads-in-two-monthsofficials-2405435.html,Chennai Corp to finish relaying roads in two months: Officials,"The IAS officers, appointed to each zone to oversee the Covid-19 preventive measures, will also monitor the laying of roads. ",published on : 11th January 2022
https://images.newindianexpress.com/uploads/user/imagelibrary/logo/nie_logo_600X390.jpg,https://www.newindianexpress.com/cities/chennai/2022/jan/11/commuters-face-tough-time-navigating-perungudi-roads-2405434.html,Commuters face tough time navigating Perungudi roads,"Want to enjoy off-roading? All you need to do is head to the Corporation Road in Perungudi.
The back-breaking road has not been relaid for half a decade and is filled with craters and potholes.",published on : 11th January 2022
https://images.newindianexpress.com/uploads/user/imagelibrary/logo/nie_logo_600X390.jpg,https://www.newindianexpress.com/nation/2022/jan/10/rahul-gandhi-returns-from-abroad-reviews-poll-strategy-for-goa-2405252.html,"Rahul Gandhi returns from abroad, reviews poll strategy for Goa",The sources said Rahul Gandhi was abroad during the last few days for the New Year and returned last night.,published on : 10th January 2022
https://images.newindianexpress.com/uploads/user/imagelibrary/logo/nie_logo_600X390.jpg,https://www.newindianexpress.com/states/odisha/2022/jan/10/odisha-police-book-three-engineers-for-alleged-involvement-in-road-construction-scam-2405083.html,Odisha police book three engineers for alleged involvement in road construction scam,"The trio was booked under sections 420, 406 and 34 of the IPC basing on the FIR of Superintending Engineer of RD department of Jajpur and Kendrapara circle Sanjeeb Kumar Das.",published on : 10th January 2022
https://images.newindianexpress.com/uploads/user/imagelibrary/logo/nie_logo_600X390.jpg,https://www.newindianexpress.com/states/andhra-pradesh/2022/jan/10/ttd-to-reopen-alipiri-ghat-road-tomorrow-2405093.html,TTD to reopen Alipiri ghat road tomorrow,The Tirumala Tirupati Devasthanams (TTD) had diverted vehicular traffic to Tirumala through the link road to undertake repair works.,published on : 10th January 2022
https://images.newindianexpress.com/uploads/user/imagelibrary/logo/nie_logo_600X390.jpg,https://www.newindianexpress.com/states/andhra-pradesh/2022/jan/10/govt-sanctions-18841-cr-to-repair-82-roads-2405094.html,Govt sanctions Rs 188.41 cr to repair 82 roads,"62 roads in Krishna will be repaired with Rs 111.25 cr, Rs 77.16 cr to be used to maintain 20 roads under State Highways",published on : 10th January 2022
https://images.newindianexpress.com/uploads/user/imagelibrary/logo/nie_logo_600X390.jpg,https://www.newindianexpress.com/cities/bengaluru/2022/jan/10/shortfilm-life-at-crossroads-2404941.html,Shortfilm: Life at crossroads,"Independent filmmaker Pooja’s latest short film Amamma, starring Padma Shri B Jayashree is based on a sensitive topic of the elderly’s need for companionship.",published on : 10th January 2022
https://images.newindianexpress.com/uploads/user/imagelibrary/logo/nie_logo_600X390.jpg,https://www.newindianexpress.com/cities/chennai/2022/jan/10/road-over-bridge-construction-on-chennai-tiruvallur-high-road-causing-hardship-for-motorists-2405015.html,Road over bridge construction on Chennai-Tiruvallur High Road causing hardship for motorists,The ongoing works of road over bridge on Chennai - Tiruvallur High (CTH) Road is causing hardship to motorists in the western suburban areas.,published on : 10th January 2022
https://images.newindianexpress.com/uploads/user/imagelibrary/logo/nie_logo_600X390.jpg,https://www.newindianexpress.com/cities/chennai/2022/jan/10/toll-collection-on-outer-ring-road-from-today-2405014.html,Toll collection on Outer Ring Road from today,"The stretch, built at a cost of over Rs 1,000 crore, was inaugurated 10 months ago",published on : 10th January 2022
https://images.newindianexpress.com/uploads/user/imagelibrary/logo/nie_logo_600X390.jpg,https://www.newindianexpress.com/nation/2022/jan/09/tough-road-ahead-for-bjp-in-poll-bound-states-as-demands-yet-to-be-met-farmer-leaders-2404849.html,Tough road ahead for BJP in poll-bound states as demands yet to be met: Farmer leaders,"Samyukta Kisan Morcha (SKM), an umbrella body of 44 farm unions, will meet on January 15 to review the progress on pending demands and decide on the future course of action.",published on : 9th January 2022
https://images.newindianexpress.com/uploads/user/imagelibrary/logo/nie_logo_600X390.jpg,https://www.newindianexpress.com/states/kerala/2021/dec/04/kerala-couple-and-their-three-children-diesin-road-accident-in-saudi-arabia-2391822.html,Kerala couple and their three children dies in road accident in Saudi Arabia,The family was relocating to Jizan in southwestern Saudi Arabia after Jabir got transferred to a company there. ,published on : 4th December 2021
https://images.newindianexpress.com/uploads/user/imagelibrary/logo/nie_logo_600X390.jpg,https://www.newindianexpress.com/nation/2021/dec/04/five-hospital-staff-killed-oneinjured-in-haryana-road-accident-2391672.html,"Five hospital staff killed, one injured in Haryana road accident",Five staffers of a private hospital in Gurugram were killed and one was severely injured in a road accident near Sadhrana village on Friday.,published on : 4th December 2021
https://images.newindianexpress.com/uploads/user/imagelibrary/logo/nie_logo_600X390.jpg,https://www.newindianexpress.com/good-news/2021/nov/28/no-greater-work-than-saving-lives-this-odisha-manis-on-mission-to-save-road-accident-victims-2389064.html,'No greater work than saving lives': This Odisha man is on mission to save road accident victims,"In the last 16 years, 38-year-old Pankaj Kumar Tarai, a truck driver, has rescued 400 accident victims in Jagatsinghpur district of whom, 300 survived. ",published on : 28th November 2021
https://images.newindianexpress.com/uploads/user/imagelibrary/logo/nie_logo_600X390.jpg,https://www.newindianexpress.com/nation/2021/nov/16/two-policemen-killed-four-injured-in-road-accident-in-jks-poonch-2384440.html,"Two policemen killed, four injured in road accident in J&K's Poonch","The accident took place at Drogzian village of Bufliaz area when the driver of one of the escort vehicles of the Senior Superintendent of Police, Poonch, lost control, the officials said.",published on : 16th November 2021
https://images.newindianexpress.com/uploads/user/imagelibrary/logo/nie_logo_600X390.jpg,https://www.newindianexpress.com/nation/2021/nov/16/5-relatives-of-sushant-singh-rajput-killed-in-bihar-road-accident-2384384.html,5 relatives of Sushant Singh Rajput killed in Bihar road accident,"The SUV was badly mangled due to the impact of the collision. The truck driver and helper, however, managed to flee.",published on : 16th November 2021
https://images.newindianexpress.com/uploads/user/imagelibrary/logo/nie_logo_600X390.jpg,https://www.newindianexpress.com/states/andhra-pradesh/2021/nov/11/one-killed-and-four-injured-in-three-separate-road-accidents-in-andhras-krishna-district-2382171.html,One killed and four injured in three separate road accidents in Andhra's Krishna district,One person died and as many as four others sustained serious injuries in three different road mishaps reported in various parts of the district.,published on : 11th November 2021
https://images.newindianexpress.com/uploads/user/imagelibrary/logo/nie_logo_600X390.jpg,https://www.newindianexpress.com/states/odisha/2021/nov/11/rakshak-launched-to-help-road-accident-victims-2382188.html,‘Rakshak’ launched to help road accident victims,"On the occasion, Odisha Public Transport and Integrated Commuter System was inaugurated by the Chief Minister.",published on : 11th November 2021
https://images.newindianexpress.com/uploads/user/imagelibrary/logo/nie_logo_600X390.jpg,https://www.newindianexpress.com/states/kerala/2021/nov/01/miss-south-india-ansi-former-miss-kerala-runner-up-anjana-die-in-road-accident-in-kochi-2378296.html,"Miss South India Ansi, former Miss Kerala runner up Anjana die in road accident in Kochi",Police have checked CCTV cameras at shops in premises and found that the car was travelling at high speed and lost control on suddenly seeing the scooter in front.,published on : 1st November 2021
https://images.newindianexpress.com/uploads/user/imagelibrary/logo/nie_logo_600X390.jpg,https://www.newindianexpress.com/states/odisha/2021/oct/20/get-rs-5000-for-savinglife-of-road-accident-victims-odisha-government-2373513.html,"Get Rs 5,000 for saving life of road accident victims: Odisha government",Principal Secretary of Transport department Madhu Sudan Padhi said the scheme will motivate people to help road accident victims in emergency situations and inspire others to save innocent lives. ,published on : 20th October 2021
https://images.newindianexpress.com/uploads/user/imagelibrary/logo/nie_logo_600X390.jpg,https://www.newindianexpress.com/states/tamil-nadu/2021/oct/15/young-woman-from-tn-her-motherdies-in-a-road-accident-in-riyadh-2371918.html,"Young woman from TN, her mother dies in a road accident in Riyadh",Shyama Kanagasabapathy and her mother Malar Selvi died on the spot. Her father suffered injuries,published on : 15th October 2021
https://images.newindianexpress.com/uploads/user/imagelibrary/logo/nie_logo_600X390.jpg,https://www.newindianexpress.com/world/2021/oct/04/swedish-artist-under-protection-since-2007-for-controversial-religious-sketch-dies-in-road-accident-2367390.html,Swedish artist under protection since 2007 for controversial religious sketch dies in road accident,Vilks' life changed radically 13 years ago after he drew a sketch of Muhammad with a dog's body.,published on : 4th October 2021
https://images.newindianexpress.com/uploads/user/imagelibrary/logo/nie_logo_600X390.jpg,https://www.newindianexpress.com/states/kerala/2021/sep/28/separate-road-accidents-claim-ninelives-in-kerala-2364584.html,Separate road accidents claim nine lives in Kerala,A TV journalist died when a car hit the two-wheeler he was riding at Puzhambram near Ponnani on Sunday night.,published on : 28th September 2021
https://images.newindianexpress.com/uploads/user/imagelibrary/logo/nie_logo_600X390.jpg,https://www.newindianexpress.com/cities/thiruvananthapuram/2021/sep/23/kin-of-techie-killed-in-road-accident-to-get-rs-219-crore-2362467.html,Kin of techie killed in road accident to get Rs 2.19 crore,The 28-year-old resident of Kundamanbhagom was travelling on his bike when he was hit from behind by a speeding tipper lorry near Maruthumkuzhi bridge.,published on : 23rd September 2021
https://images.newindianexpress.com/uploads/user/imagelibrary/logo/nie_logo_600X390.jpg,https://www.newindianexpress.com/nation/2021/sep/19/120-lakh-deaths-due-to-negligence-in-road-accidents-in-2020-average-328-daily-ncrb-data-2360921.html,"1.20 lakh deaths due to negligence in road accidents in 2020, average 328 daily: NCRB data","The country also logged 1.35 lakh cases of “hit and run” since 2018, the report of the NCRB, which functions under the Union Home Ministry, showed.",published on : 19th September 2021
https://images.newindianexpress.com/uploads/user/imagelibrary/logo/nie_logo_600X390.jpg,https://www.newindianexpress.com/cities/thiruvananthapuram/2021/sep/16/no-letupin-road-accidents-in-kerala-capital-2359249.html,No letup in road accidents in Kerala capital,"Even as the police have been carrying out various awareness drives to curb traffic violations, there is no dip in the number of road accidents in the district.",published on : 16th September 2021
https://images.newindianexpress.com/uploads/user/imagelibrary/logo/nie_logo_600X390.jpg,https://www.newindianexpress.com/nation/2021/sep/14/one-dead-15-injured-in-two-road-accidents-on-yamuna-expressway-police-2358299.html,"One dead, 15 injured in two road accidents on Yamuna Expressway: Police ","The first accident occurred when a truck coming from Noida side rammed against a stationary canter near the '92 km' milestone, resulting in the death of one, injury to two others early this morning.",published on : 14th September 2021
https://images.newindianexpress.com/uploads/user/imagelibrary/logo/nie_logo_600X390.jpg,https://www.newindianexpress.com/states/karnataka/2021/sep/13/eight-die-in-chikkaballapur-road-accident-2357883.html,Eight die in Chikkaballapur road accident,Eight people lost their lives when a goods vehicle rammed their jeep near Madikere Cross of Madanpalli-Chinthamani Road near here on Sunday.,published on : 13th September 2021
https://images.newindianexpress.com/uploads/user/imagelibrary/logo/nie_logo_600X390.jpg,https://www.newindianexpress.com/entertainment/telugu/2021/sep/11/tollywood-actor-sai-dharam-tej-meetswith-road-accident-suffers-collarbone-injury-2357219.html,"Tollywood actor Sai Dharam Tej meets with road accident, suffers collarbone injury","He was wearing a helmet at the time of the incident. Prima facie, it's found that he was not in a drunken condition. ",published on : 11th September 2021
https://images.newindianexpress.com/uploads/user/imagelibrary/logo/nie_logo_600X390.jpg,https://www.newindianexpress.com/opinions/editorials/2021/sep/03/karnataka-road-accident-another-wake-up-call-2353482.html,Karnataka road accident another wake-up call,Such accidents threaten to be more frequent with the Covid-19 pandemic on a decline and the youth coming out in hordes to reclaim freedom that had been curtailed due to lockdowns.,published on : 3rd September 2021
https://images.newindianexpress.com/uploads/user/imagelibrary/logo/nie_logo_600X390.jpg,https://www.newindianexpress.com/states/telangana/2021/sep/02/mptc-member-husband-killed-in-road-accident-on-their-way-tohyderabad-2353111.html,"MPTC member, husband killed in road accident on their way to Hyderabad","As per the police, the accident happened when the tipper lorry’s driver applied sudden brakes, causing the couple’s car to ram into the lorry.",published on : 2nd September 2021
https://images.newindianexpress.com/uploads/user/imagelibrary/logo/nie_logo_600X390.jpg,https://www.newindianexpress.com/states/karnataka/2021/sep/01/freak-road-accident-on-audi-snuffs-out-lives-of-seven-youths-2352537.html,Freak road accident on Audi snuffs out lives of seven youths,"Karuna Sagar (25), the only son of Hosur DMK MLA Prakash Y, had come to Bengaluru on his Audi Q3 with the Karnataka registration number and picked up his friends.",published on : 1st September 2021
https://images.newindianexpress.com/uploads/user/imagelibrary/logo/nie_logo_600X390.jpg,https://www.newindianexpress.com/nation/2021/aug/31/twelve-pilgrims-killed-six-others-injured-in-road-accident-in-rajasthans-nagaur-2352362.html,"Twelve pilgrims killed, six others injured in road accident in Rajasthan's Nagaur","The accident occurred near the Shri Balaji temple on the Bikaner-Jodhpur Highway, they said, adding eight women and two minors were among those killed.",published on : 31st August 2021
https://images.newindianexpress.com/uploads/user/imagelibrary/logo/nie_logo_600X390.jpg,https://www.newindianexpress.com/states/andhra-pradesh/2021/aug/30/five-including-four-women-killed-in-road-accident-in-andhra-pradesh-10-injured-2351838.html,"Five including four women killed in road accident in Andhra Pradesh, 10 injured",Police said the deceased hail from Darsi and went to Bestavaripet on Sunday evening to fix a marriage alliance. The mishap took place when they were returning back to Darsi.,published on : 30th August 2021
https://images.newindianexpress.com/uploads/user/imagelibrary/logo/nie_logo_600X390.jpg,https://www.newindianexpress.com/nation/2021/aug/28/madhya-pradesh-tribal-thrashed-after-road-accident-tied-to-vehicle-and-dragged-by-gurjar-men-dies-2351158.html,"Madhya Pradesh: Tribal thrashed after road accident, tied to vehicle and dragged by Gurjar men, dies","The incident occurred after one of the accused, a milkman, knocked down the victim, Kanhaiyalal Bheel, and in the process spilt his milk and as a result, lost his cool and beat up the victim.",published on : 28th August 2021
https://images.newindianexpress.com/uploads/user/imagelibrary/logo/nie_logo_600X390.jpg,https://www.newindianexpress.com/states/tamil-nadu/2021/aug/28/theni-district-collector-rescues-man-who-broke-leg-in-road-accident-rushes-him-to-hospital-2351087.html,"Theni district collector rescues man who broke leg in road accident, rushes him to hospital","The collector K V Muralidharan, who was on the way from Kumuli to Theni after finishing his inspection at border check posts, witnessed the two wheeler rider caught in an accident near Anumathapatti",published on : 28th August 2021
https://images.newindianexpress.com/uploads/user/imagelibrary/logo/nie_logo_600X390.jpg,https://www.newindianexpress.com/cities/thiruvananthapuram/2021/aug/27/law-student-two-others-die-in-two-road-accidents-2350350.html,"Law student, two others die in two road accidents","Auto driver, dialysis patient killed as vehicle collides with car",published on : 27th August 2021
https://images.newindianexpress.com/uploads/user/imagelibrary/logo/nie_logo_600X390.jpg,https://www.newindianexpress.com/states/odisha/2021/aug/16/odisha-launches-mobile-app-for-integrated-road-accident-database-2345445.html,Odisha launches mobile app for integrated road accident database,The application will enable the collection of accident data on the spot and help analyse causes of road accidents and help reduce fatalities.,published on : 16th August 2021
https://images.newindianexpress.com/uploads/user/imagelibrary/logo/nie_logo_600X390.jpg,https://www.newindianexpress.com/nation/2021/aug/14/two-cops-among-four-killed-in-road-accident-in-haryanas-ambala-2344697.html,Two cops among four killed in road accident in Haryana's Ambala,"Two police officials were standing near their police van and talking to two other victims when the truck hit their vehicle, police said.",published on : 14th August 2021
https://images.newindianexpress.com/uploads/user/imagelibrary/logo/nie_logo_600X390.jpg,https://www.newindianexpress.com/nation/2021/aug/10/jawan-joins-rescue-operation-after-road-accident-finds-mother-among-dead-in-chhattisgarh-2342882.html,"Jawan joins rescue operation after road accident, finds mother among dead in Chhattisgarh","Four persons including two teenagers and a woman were killed in the incident that occurred between the Tetam and Telam village of Dantewada, about 450 km south of Raipur.",published on : 10th August 2021
https://images.newindianexpress.com/uploads/user/imagelibrary/logo/nie_logo_600X390.jpg,https://www.newindianexpress.com/nation/2021/aug/08/five-people-including-4-children-dead-in-road-accident-in-ups-mau-2341965.html,"Five people, including 4 children, dead in road accident in UP's Mau",The accident took place in Sonbarsa village under Dohrighat police station area of the district. Two people sustained injuries in the incident.,published on : 8th August 2021
https://images.newindianexpress.com/uploads/user/imagelibrary/logo/nie_logo_600X390.jpg,https://www.newindianexpress.com/states/telangana/2021/aug/06/five-killed-in-road-accident-in-telanganas-sangareddy-district-2341115.html,Five killed in road accident in Telangana's Sangareddy district,The family from Kulcharam in Medak district had gone to Sangareddy for the child's health check and were returning home.,published on : 6th August 2021
https://images.newindianexpress.com/uploads/user/imagelibrary/logo/nie_logo_600X390.jpg,https://www.newindianexpress.com/world/2021/aug/04/indian-truck-driver-dies-in-road-accident-in-uss-arizona-2339956.html,Indian truck driver dies in road accident in US's Arizona,"The incident is reported to have occurred around 11 pm Monday on Highway 40 near Flagstaff in Arizona, as the victim was taking a consignment from Georgia to California.",published on : 4th August 2021
https://images.newindianexpress.com/uploads/user/imagelibrary/logo/nie_logo_600X390.jpg,https://www.newindianexpress.com/states/kerala/2021/aug/01/organ-donation-road-accident-victim-from-kerala-to-live-on-through-five-others-2338437.html,Organ donation: Road accident victim from Kerala to live on through five others,Health Minister Veena George praised Lincy for taking an exemplary stand and being a model for society.,published on : 1st August 2021
https://images.newindianexpress.com/uploads/user/imagelibrary/logo/nie_logo_600X390.jpg,https://www.newindianexpress.com/states/odisha/2021/jul/31/joint-inspection-of-road-accident-spots-a-must-from-august-1-2338066.html,Joint inspection of road accident spots a must in Odisha from August 1,The State government has directed the district collectors to conduct joint inspections of accident spots from August 1 and share the data with the Transport department regularly without fail. ,published on : 31st July 2021
https://images.newindianexpress.com/uploads/user/imagelibrary/logo/nie_logo_600X390.jpg,https://www.newindianexpress.com/states/odisha/2021/jul/30/dont-skip-joint-inspection-of-road-accident-spots-odisha-govt-warns-district-collectors-2337692.html,"Don't skip joint inspection of road accident spots, Odisha govt warns District Collectors",The direction came after most of the districts were found skipping joint inspections of accident spots in defiance of the Supreme Court Committee on Road Safety,published on : 30th July 2021
https://images.newindianexpress.com/uploads/user/imagelibrary/logo/nie_logo_600X390.jpg,https://www.newindianexpress.com/nation/2021/jul/26/india-witnessed-449-lakh-road-accidents151-lakh-deaths-in-2019-2335648.html,"India witnessed 4.49 lakh road accidents, 1.51 lakh deaths in 2019","The number of road accidents in 2018 was 4,67,044 and deaths were recorded at 1,51,417.",published on : 26th July 2021
https://images.newindianexpress.com/uploads/user/imagelibrary/logo/nie_logo_600X390.jpg,https://www.newindianexpress.com/states/kerala/2021/jul/23/karipur-gold-smuggling-case-suspect-and-friend-of-prime-accused-killed-in-road-accident-2334329.html,Karipur gold smuggling case: Suspect and friend of prime accused killed in road accident,"Though the Customs department had asked Rameez to appear before them in connection with the investigation on Thursday, he had not appeared before the agency",published on : 23rd July 2021
https://images.newindianexpress.com/uploads/user/imagelibrary/logo/nie_logo_600X390.jpg,https://www.newindianexpress.com/states/andhra-pradesh/2021/jul/20/wear-bis-standard-helmets-to-avoid-road-accidents-andhra-dgp-2332609.html,Wear BIS standard helmets to avoid road accidents: Andhra DGP,"According to a report by the Union Ministry of Road Transport and Highways, Andhra Pradesh stands on the eighth spot in the number of road mishaps recorded in a year.",published on : 20th July 2021
https://images.newindianexpress.com/uploads/user/imagelibrary/logo/nie_logo_600X390.jpg,https://www.newindianexpress.com/states/karnataka/2021/jul/20/four-killed-in-road-accident-near-kalaburagi-city-in-karnataka-2332746.html,Four killed in road accident near Kalaburagi city in Karnataka,The injured has been admitted in a private hospital at Kalaburagi and the bodies of the deceased persons have been sent for postmortem.,published on : 20th July 2021
https://images.newindianexpress.com/uploads/user/imagelibrary/logo/nie_logo_600X390.jpg,https://www.newindianexpress.com/cities/kochi/2021/jul/15/fast-and-furious-driving-by-food-delivery-boys-results-in-road-accidents-2330290.html,Fast and furious driving by food delivery boys results in road accidents,"Competition with rival companies and deadline forcing them to take such risks, they say",published on : 15th July 2021
https://images.newindianexpress.com/uploads/user/imagelibrary/logo/nie_logo_600X390.jpg,https://www.newindianexpress.com/states/andhra-pradesh/2021/jul/07/andhras-antarvedi-temple-chariot-fire-suspect-dies-in-road-accident-2326679.html,Andhra's Antarvedi temple chariot fire ‘suspect’ dies in road accident,"According to police, Yakub Ali covered himself with a polyethylene sheet and slept on the road at Sakhinetipalli.",published on : 7th July 2021
https://images.newindianexpress.com/uploads/user/imagelibrary/logo/nie_logo_600X390.jpg,https://www.newindianexpress.com/nation/2021/jun/29/six-die-in-road-accident-in-raigarh-district-of-chhattisgarh-2322989.html,Six die in road accident in Raigarh district of Chhattisgarh,"The victims were returning to their village Chaal after attending a wedding ceremony,"" Raigarh superintendent of polcie Santosh Singh said. ",published on : 29th June 2021
https://images.newindianexpress.com/uploads/user/imagelibrary/logo/nie_logo_600X390.jpg,https://www.newindianexpress.com/states/tamil-nadu/2021/jun/24/tamil-nadu-cag-report-flags-poordriving-licence-tests-indictstransport-dept-for-road-accident-de-2320979.html,"CAG report flags poor driving licence tests in TN, indicts transport, highways dept for road accident deaths","The report said Chennai police in 2018 recommended 2,986 accident cases to RTOs for suspension of Driving licences but only 1,628 were suspended.",published on : 24th June 2021
https://images.newindianexpress.com/uploads/user/imagelibrary/logo/nie_logo_600X390.jpg,https://www.newindianexpress.com/states/tamil-nadu/2021/jun/23/district-level-officers-to-checkroad-accident-claims-disbursal-2320153.html,District level officers to check road accident claims disbursal,A special bench of Justices P N Prakash and Abdul Quddhose passed the interim orders on the plea after it was brought to its notice.,published on : 23rd June 2021
